<?xml version="1.0" encoding="UTF-8"?>
<!DOCTYPE project PUBLIC "quokka.ws/dtd/project-0.1" "http://quokka.ws/dtd/project-0.1.dtd">

<project name="core.model">
    <artifacts group="quokka.core.model" version="0.1">
        <artifact paths="runtime"/>
    </artifacts>

<!--
    <bootstrap>
        <cores>
            <core version="1.0-m01"/>
        </cores>
        <jdks java-version="">
            <jdk max-memory="512m" spec-version="1.6">
                <sysproperty name="os.arch" value="Windows" required="true"/>
            </jdk>
        </jdks>
        <boot-dependency group="asdfasf" name="sfsdfs" version="asfa"/>
    </bootstrap>
-->

    <dependency-set>
        <dependency group="quokka.core.test" version="0.1" paths="test-compile(junit)"/>
        <dependency group="quokka.core.repo-spi" version="0.1" paths="compile, runtime"/>
        <dependency group="quokka.core.util" version="0.1" paths="compile, runtime"/>
        <dependency group="quokka.core.bootstrap-util" version="0.1" paths="compile, runtime"/>
        <dependency group="quokka.core.version" version="0.1" paths="compile, runtime"/>
        <dependency group="quokka.core.plugin-spi" version="0.1" paths="compile, runtime"/>
        <dependency group="apache.ant" version="1.7.0" paths="compile, runtime"/>

        <dependency-set group="quokka.internal.module-depset" version="0.1"/>
    </dependency-set>
</project>
