<?xml version="1.0" encoding="UTF-8"?>
<!DOCTYPE project PUBLIC "quokka.ws/dtd/project-0.1" "http://quokka.ws/dtd/project-0.1.dtd">

<project>
    <artifacts group="quokka.core.metadata" version="0.1.1">
        <artifact paths="runtime"/>
    </artifacts>

    <bootstrap core="[0.1.2,0.1.2]" spec-version="[1.4,1.6]"/>

    <dependency-set>
        <dependency group="quokka.core.test" version="0.1.1" paths="test-compile(junit)"/>
        <dependency group="quokka.core.repo-spi" version="0.2" paths="compile, runtime"/>
        <dependency-set group="quokka.internal.module-depset" version="0.1.2"/>
    </dependency-set>
</project>
