<?xml version="1.0" encoding="UTF-8"?>
<!DOCTYPE project PUBLIC "quokka.ws/dtd/project-0.1" "http://quokka.ws/dtd/project-0.1.dtd">

<project name="internal.master">
    <description>Quokka master module for building and managing all other modules at once</description>

    <bootstrap core="[0.2.1,0.2.1]" spec-version="[1.4,1.6]"/>
    <!--<bootstrap>-->
    <!--<cores version="1.0">-->
    <!--<core options="xerces, xercesimpl" profiles="jdk1.2, jdk1.3"/>-->
    <!--<core profiles="-jdk1.2, -jdk1.3"/>-->
    <!--</cores>-->
    <!--<jdks jvm-args="-Xmx1024m">-->
    <!--<jdk spec-verion="1.2" profiles="jdk1.2"/>-->
    <!--<jdk spec-verion="1.3" profiles="jdk1.3"/>-->
    <!--<jdk spec-verion="1.4" profiles="jdk1.4"/>-->
    <!--<jdk spec-verion="1.5" profiles="jdk1.5"/>-->
    <!--<jdk spec-verion="1.6" profiles="jdk1.6"/>-->
    <!--</jdks>-->
    <!--</bootstrap>-->

    <dependency-set>
        <plugin group="quokka.plugin.standard-lifecycle" version="0.2.2"/>
        <plugin group="quokka.plugin.cobertura" version="0.2.1" use-defaults="false"
                targets="aggregate-report"/>
        <plugin group="quokka.plugin.junitreport" version="0.2.2" use-defaults="false"
                targets="aggregate-report"/>
        <plugin group="quokka.plugin.help" version="0.2.2" use-defaults="false"
                targets="aggregate-report, help"/>
        <plugin group="quokka.plugin.devreport" version="0.2.1" use-defaults="false" targets="reports"/>
        <plugin group="quokka.plugin.subversion" version="0.2.1"/>
    </dependency-set>
</project>
