<?xml version="1.0" encoding="UTF-8"?>
<!DOCTYPE project PUBLIC "quokka.ws/dtd/project-0.1" "http://quokka.ws/dtd/project-0.1.dtd">

<project name="core.bundle">
    <artifacts group="quokka.bundle" version="0.1">
        <artifact name="core"/>
    </artifacts>

    <!--<bootstrap>-->
    <!--<cores version="1.0">-->
    <!--<core options="xerces, xercesimpl" profiles="jdk1.2, jdk1.3"/>-->
    <!--<core profiles="-jdk1.2, -jdk1.3"/>-->
    <!--</cores>-->
    <!--<jdks max-memory="1024m">-->
    <!--<jdk spec-verion="1.2" profiles="jdk1.2"/>-->
    <!--<jdk spec-verion="1.3" profiles="jdk1.3"/>-->
    <!--<jdk spec-verion="1.4" profiles="jdk1.4"/>-->
    <!--<jdk spec-verion="1.5" profiles="jdk1.5"/>-->
    <!--<jdk spec-verion="1.6" profiles="jdk1.6"/>-->
    <!--</jdks>-->
    <!--</bootstrap>-->

    <dependency-set>
        <path id="dist" description="Libraries required for the runtime distribution"/>
        <dependency group="apache.ant" version="1.7.0" paths="dist+"/>
        <dependency group="apache.ant" name="ant-launcher" version="1.7.0" paths="dist+"/>

        <!-- Libraries for the core bundle -->
        <plugin group="quokka.plugin.jarbundle" version="0.1" targets="package"/>
        <dependency group="quokka.core.main" version="0.1" paths="jarbundle+"/>
        <dependency group="quokka.core.metadata" version="0.1" paths="jarbundle+"/>
        <dependency group="quokka.core.model" version="0.1" paths="jarbundle+"/>
        <dependency group="quokka.core.plugin-spi" version="0.1" paths="jarbundle+"/>
        <dependency group="quokka.core.repo-spi" version="0.1" paths="jarbundle+"/>
        <dependency group="quokka.core.repo-standard" version="0.1" paths="jarbundle+"/>
        <dependency group="quokka.core.util" version="0.1" paths="jarbundle+"/>
        <dependency group="quokka.core.bootstrap" version="0.1" paths="jarbundle+"/>
        <dependency group="quokka.core.bootstrap-util" version="0.1" paths="jarbundle+"/>
        <dependency group="quokka.core.version" version="0.1" paths="jarbundle+"/>

        <plugin group="quokka.plugin.standard-lifecycle" version="0.1"/>

        <dependency-set group="quokka.internal.docbook-depset" version="0.1"/>
        <plugin group="quokka.plugin.xml" version="0.1">
            <target template="transform" name="docbook" prefix="docbook"/>
        </plugin>
        <plugin group="quokka.plugin.fop" version="0.1">
            <target name="docbook-pdf" template="transform" prefix="docbook-pdf" depends="docbook"/>
        </plugin>
        <plugin group="quokka.plugin.devreport" version="0.1"/>
        <plugin group="quokka.plugin.help" version="0.1"/>
    </dependency-set>
</project>
