<?xml version="1.0" encoding="UTF-8"?>
<!DOCTYPE project PUBLIC "quokka.ws/dtd/project-0.1" "http://quokka.ws/dtd/project-0.1.dtd">

<project>
    <artifacts group="quokka.core.main" version="0.1.1-ss">
        <artifact paths="runtime, dist"/>
    </artifacts>

    <bootstrap core="[0.1,0.1]" spec-version="[1.4,1.6]"/>

    <dependency-set>
        <path id="dist" description="Libraries required for the runtime distribution"/>
        <dependency group="apache.ant" version="1.7.0" paths="dist+"/>
        <dependency group="apache.ant" name="ant-launcher" version="1.7.0" paths="dist+"/>

        <dependency group="quokka.core.repo-spi" version="0.1" paths="compile, runtime"/>
        <dependency group="quokka.core.repo-standard" version="0.1" paths="compile, runtime"/>
        <dependency group="quokka.core.metadata" version="0.1" paths="compile, runtime"/>
        <dependency group="quokka.core.model" version="0.1" paths="compile, runtime"/>
        <dependency group="quokka.core.bootstrap" version="0.1" paths="compile, runtime"/>
        <dependency group="quokka.core.bootstrap-util" version="0.1" paths="compile, runtime"/>
        <dependency group="quokka.core.version" version="0.1" paths="compile, runtime"/>
        <dependency group="quokka.core.plugin-spi" version="0.1" paths="compile, runtime"/>
        <dependency group="quokka.core.util" version="0.1" paths="compile, runtime"/>
        <dependency group="apache.ant" version="1.7.0" paths="compile, runtime"/>
        <dependency group="apache.ant" name="ant-launcher" version="1.7.0" paths="compile, runtime"/>
        <dependency group="quokka.core.test" version="0.1" paths="test-compile(junit)"/>
        <dependency group="quokka.core.itest" version="0.1" paths="itest"/>

        <plugin group="quokka.plugin.devreport" version="0.1"/>
        <plugin group="quokka.plugin.help" version="0.1"/>
        <dependency-set group="quokka.internal.module-depset" version="0.1"/>
    </dependency-set>
</project>
